<Fight Terrain='Sand' xsi:schemaLocation='urn:x-plazacraft.org:plazacraft.homm3-1.0-damagesymulator http://homm3.plazacraft.com/damagesymulator/schemas/Plazacraft.HOMM3.DamageSymulator.Fight.xsd' xmlns='urn:x-plazacraft.org:plazacraft.homm3-1.0-damagesymulator' xmlns:xs='http://www.w3.org/2001/XMLSchema' xmlns:xsi='http://www.w3.org/2001/XMLSchema-instance'>
    <Attacker Attack='0' Defense='0' Level='0'>
        <Creature Name='Griffin' Count='17' AttackType='Melee' Luck='false' RangePenalty='None' ObstaclePenalty='None'/>
        <Creature Name='Wood Elf' Count='14' AttackType='Ranged' Luck='false' RangePenalty='None' ObstaclePenalty='None'/>
        <Creature Name='Stone Golem' Count='12' AttackType='Melee' Luck='false' RangePenalty='None' ObstaclePenalty='None'/>
        <Creature Name='Hell Hound' Count='13' AttackType='Melee' Luck='false' RangePenalty='None' ObstaclePenalty='None'/>
        <Creature Name='Wight' Count='14' AttackType='Melee' Luck='false' RangePenalty='None' ObstaclePenalty='None'/>
        <Creature Name='Beholder' Count='14' AttackType='Ranged' Luck='false' RangePenalty='None' ObstaclePenalty='None'/>
        <Creature Name='Orc' Count='14' AttackType='Ranged' Luck='false' RangePenalty='None' ObstaclePenalty='None'/>
        <Creature Name='Serpent Fly' Count='16' AttackType='Melee' Luck='false' RangePenalty='None' ObstaclePenalty='None'/>
        <Creature Name='Water Elemental' Count='12' AttackType='Melee' Luck='false' RangePenalty='None' ObstaclePenalty='None'/>
        <Creature Name='Pirate' Count='14' AttackType='Ranged' Luck='false' RangePenalty='None' ObstaclePenalty='None'/>
        <Creature Name='Mummy' Count='7' AttackType='Melee' Luck='false' RangePenalty='None' ObstaclePenalty='None'/>
        <Creature Name='Nomad' Count='7' AttackType='Melee' Luck='false' RangePenalty='None' ObstaclePenalty='None'/>
    </Attacker>
    <Defender Attack='0' Defense='0' Level='0'>
        <Creature Name='Griffin' Count='17' AttackType='Melee' Luck='false' RangePenalty='None' ObstaclePenalty='None'/>
        <Creature Name='Wood Elf' Count='14' AttackType='Ranged' Luck='false' RangePenalty='None' ObstaclePenalty='None'/>
        <Creature Name='Stone Golem' Count='12' AttackType='Melee' Luck='false' RangePenalty='None' ObstaclePenalty='None'/>
        <Creature Name='Hell Hound' Count='13' AttackType='Melee' Luck='false' RangePenalty='None' ObstaclePenalty='None'/>
        <Creature Name='Wight' Count='14' AttackType='Melee' Luck='false' RangePenalty='None' ObstaclePenalty='None'/>
        <Creature Name='Beholder' Count='14' AttackType='Ranged' Luck='false' RangePenalty='None' ObstaclePenalty='None'/>
        <Creature Name='Orc' Count='14' AttackType='Ranged' Luck='false' RangePenalty='None' ObstaclePenalty='None'/>
        <Creature Name='Serpent Fly' Count='16' AttackType='Melee' Luck='false' RangePenalty='None' ObstaclePenalty='None'/>
        <Creature Name='Water Elemental' Count='12' AttackType='Melee' Luck='false' RangePenalty='None' ObstaclePenalty='None'/>
        <Creature Name='Pirate' Count='14' AttackType='Ranged' Luck='false' RangePenalty='None' ObstaclePenalty='None'/>
        <Creature Name='Mummy' Count='7' AttackType='Melee' Luck='false' RangePenalty='None' ObstaclePenalty='None'/>
        <Creature Name='Nomad' Count='7' AttackType='Melee' Luck='false' RangePenalty='None' ObstaclePenalty='None'/>
    </Defender>
</Fight>