<Fight Terrain='Sand' xsi:schemaLocation='urn:x-plazacraft.org:plazacraft.homm3-1.0-damagesymulator http://homm3.plazacraft.com/damagesymulator/schemas/Plazacraft.HOMM3.DamageSymulator.Fight.xsd' xmlns='urn:x-plazacraft.org:plazacraft.homm3-1.0-damagesymulator' xmlns:xs='http://www.w3.org/2001/XMLSchema' xmlns:xsi='http://www.w3.org/2001/XMLSchema-instance'>
    <Attacker Attack='0' Defense='0' Level='0'>
        <Creature Name='Pikeman' Count='28' AttackType='Melee' Luck='false' RangePenalty='None' ObstaclePenalty='None'/>
        <Creature Name='Centaur' Count='28' AttackType='Melee' Luck='false' RangePenalty='None' ObstaclePenalty='None'/>
        <Creature Name='Gremlin' Count='32' AttackType='Melee' Luck='false' RangePenalty='None' ObstaclePenalty='None'/>
        <Creature Name='Imp' Count='38' AttackType='Melee' Luck='false' RangePenalty='None' ObstaclePenalty='None'/>
        <Creature Name='Skeleton' Count='30' AttackType='Melee' Luck='false' RangePenalty='None' ObstaclePenalty='None'/>
        <Creature Name='Troglodyte' Count='35' AttackType='Melee' Luck='false' RangePenalty='None' ObstaclePenalty='None'/>
        <Creature Name='Goblin' Count='38' AttackType='Melee' Luck='false' RangePenalty='None' ObstaclePenalty='None'/>
        <Creature Name='Gnoll' Count='30' AttackType='Melee' Luck='false' RangePenalty='None' ObstaclePenalty='None'/>
        <Creature Name='Pixie' Count='50' AttackType='Melee' Luck='false' RangePenalty='None' ObstaclePenalty='None'/>
        <Creature Name='Nymph' Count='32' AttackType='Melee' Luck='false' RangePenalty='None' ObstaclePenalty='None'/>
        <Creature Name='Peasant' Count='25' AttackType='Melee' Luck='false' RangePenalty='None' ObstaclePenalty='None'/>
        <Creature Name='Halfling' Count='15' AttackType='Ranged' Luck='false' RangePenalty='None' ObstaclePenalty='None'/>
    </Attacker>
    <Defender Attack='0' Defense='0' Level='0'>
        <Creature Name='Pikeman' Count='28' AttackType='Melee' Luck='false' RangePenalty='None' ObstaclePenalty='None'/>
        <Creature Name='Centaur' Count='28' AttackType='Melee' Luck='false' RangePenalty='None' ObstaclePenalty='None'/>
        <Creature Name='Gremlin' Count='32' AttackType='Melee' Luck='false' RangePenalty='None' ObstaclePenalty='None'/>
        <Creature Name='Imp' Count='38' AttackType='Melee' Luck='false' RangePenalty='None' ObstaclePenalty='None'/>
        <Creature Name='Skeleton' Count='30' AttackType='Melee' Luck='false' RangePenalty='None' ObstaclePenalty='None'/>
        <Creature Name='Troglodyte' Count='35' AttackType='Melee' Luck='false' RangePenalty='None' ObstaclePenalty='None'/>
        <Creature Name='Goblin' Count='38' AttackType='Melee' Luck='false' RangePenalty='None' ObstaclePenalty='None'/>
        <Creature Name='Gnoll' Count='30' AttackType='Melee' Luck='false' RangePenalty='None' ObstaclePenalty='None'/>
        <Creature Name='Pixie' Count='50' AttackType='Melee' Luck='false' RangePenalty='None' ObstaclePenalty='None'/>
        <Creature Name='Nymph' Count='32' AttackType='Melee' Luck='false' RangePenalty='None' ObstaclePenalty='None'/>
        <Creature Name='Peasant' Count='25' AttackType='Melee' Luck='false' RangePenalty='None' ObstaclePenalty='None'/>
        <Creature Name='Halfling' Count='15' AttackType='Ranged' Luck='false' RangePenalty='None' ObstaclePenalty='None'/>
    </Defender>
</Fight>