<Fight Terrain='Sand' xsi:schemaLocation='urn:x-plazacraft.org:plazacraft.homm3-1.0-damagesymulator http://homm3.plazacraft.com/damagesymulator/schemas/Plazacraft.HOMM3.DamageSymulator.Fight.xsd' xmlns='urn:x-plazacraft.org:plazacraft.homm3-1.0-damagesymulator' xmlns:xs='http://www.w3.org/2001/XMLSchema' xmlns:xsi='http://www.w3.org/2001/XMLSchema-instance'>
    <Attacker Attack='0' Defense='0' Level='0'>
        <Creature Name='Archer' Count='18' AttackType='Ranged' Luck='false' RangePenalty='None' ObstaclePenalty='None'/>
        <Creature Name='Dwarf' Count='20' AttackType='Melee' Luck='false' RangePenalty='None' ObstaclePenalty='None'/>
        <Creature Name='Stone Gargoyle' Count='22' AttackType='Melee' Luck='false' RangePenalty='None' ObstaclePenalty='None'/>
        <Creature Name='Gog' Count='16' AttackType='Ranged' Luck='false' RangePenalty='None' ObstaclePenalty='None'/>
        <Creature Name='Walking Dead' Count='16' AttackType='Melee' Luck='false' RangePenalty='None' ObstaclePenalty='None'/>
        <Creature Name='Harpy' Count='16' AttackType='Melee' Luck='false' RangePenalty='None' ObstaclePenalty='None'/>
        <Creature Name='Wolf Rider' Count='18' AttackType='Melee' Luck='false' RangePenalty='None' ObstaclePenalty='None'/>
        <Creature Name='Lizardman' Count='18' AttackType='Ranged' Luck='false' RangePenalty='None' ObstaclePenalty='None'/>
        <Creature Name='Air Elemental' Count='12' AttackType='Melee' Luck='false' RangePenalty='None' ObstaclePenalty='None'/>
        <Creature Name='Crew Mate' Count='22' AttackType='Melee' Luck='false' RangePenalty='None' ObstaclePenalty='None'/>
        <Creature Name='Boar' Count='8' AttackType='Melee' Luck='false' RangePenalty='None' ObstaclePenalty='None'/>
        <Creature Name='Rogue' Count='8' AttackType='Melee' Luck='false' RangePenalty='None' ObstaclePenalty='None'/>
        <Creature Name='Leprechaun' Count='8' AttackType='Melee' Luck='false' RangePenalty='None' ObstaclePenalty='None'/>
    </Attacker>
    <Defender Attack='0' Defense='0' Level='0'>
        <Creature Name='Archer' Count='18' AttackType='Ranged' Luck='false' RangePenalty='None' ObstaclePenalty='None'/>
        <Creature Name='Dwarf' Count='20' AttackType='Melee' Luck='false' RangePenalty='None' ObstaclePenalty='None'/>
        <Creature Name='Stone Gargoyle' Count='22' AttackType='Melee' Luck='false' RangePenalty='None' ObstaclePenalty='None'/>
        <Creature Name='Gog' Count='16' AttackType='Ranged' Luck='false' RangePenalty='None' ObstaclePenalty='None'/>
        <Creature Name='Walking Dead' Count='16' AttackType='Melee' Luck='false' RangePenalty='None' ObstaclePenalty='None'/>
        <Creature Name='Harpy' Count='16' AttackType='Melee' Luck='false' RangePenalty='None' ObstaclePenalty='None'/>
        <Creature Name='Wolf Rider' Count='18' AttackType='Melee' Luck='false' RangePenalty='None' ObstaclePenalty='None'/>
        <Creature Name='Lizardman' Count='18' AttackType='Ranged' Luck='false' RangePenalty='None' ObstaclePenalty='None'/>
        <Creature Name='Air Elemental' Count='12' AttackType='Melee' Luck='false' RangePenalty='None' ObstaclePenalty='None'/>
        <Creature Name='Crew Mate' Count='22' AttackType='Melee' Luck='false' RangePenalty='None' ObstaclePenalty='None'/>
        <Creature Name='Boar' Count='8' AttackType='Melee' Luck='false' RangePenalty='None' ObstaclePenalty='None'/>
        <Creature Name='Rogue' Count='8' AttackType='Melee' Luck='false' RangePenalty='None' ObstaclePenalty='None'/>
        <Creature Name='Leprechaun' Count='8' AttackType='Melee' Luck='false' RangePenalty='None' ObstaclePenalty='None'/>
    </Defender>
</Fight>